<?xml version="1.0"?>
<!DOCTYPE dtdHostCfgDoc SYSTEM "lbXMLConfig.dtd">

<dtdHostCfgDoc VERSION="1.0.0">
  <Busmaster ID="ID1" Hostname="localhost" Port="5001" Description="Any description" />
<!--
  <BootstrapModule Name="lbClasses" />
-->

<!--
  A possible better way may a mapping from interfaces to their functors like this:
  
  <Map Interface="lb_I_Log" Module="lbclasses" Functor="..." />
  
  But in this way a mapping can contain multiple entries of the same mapping.
  
-->

  <StandardFunctor 
    Interface="lb_I_String" 
    Functor="_instanceOfString@4"
    Module="lbclasses" />
  <StandardFunctor 
    Interface="lb_I_Integer" 
    Functor="_instanceOfInteger@4"
    Module="lbclasses" />
  <StandardFunctor 
    Interface="lb_I_Long" 
    Functor="_instanceOfLong@4"
    Module="lbclasses" />
  
<!--...sModules:2:-->
  <Modules>
    <Module>
<!--...sModuleName lbclasses:8:-->
      <ModuleName Name="lbclasses"/>
<!--...e-->
<!--...sFunctions:8:-->
      <Functions>
<!--...sFunction instanceOfContainer:16:-->
        <Function>
           <FunctionName Name="_instanceOfContainer@4"/>
           <Functor>
              <InterfaceName Name="lb_I_Container" Version="1.0"/>
           </Functor>
        </Function>
<!--...e-->
<!--...sFunction instanceOfLogger:16:-->
        <Function>
           <FunctionName Name="_instanceOfLogger@4"/>
           <Functor>
              <InterfaceName Name="lb_I_Log" Version="1.0"/>
           </Functor>
        </Function>
<!--...e-->
<!--...sFunction instanceOfIntegerKey:16:-->
        <Function>
           <FunctionName Name="_instanceOfIntegerKey@4"/>
           <Functor>
              <InterfaceName Name="lb_I_KeyBase" Version="1.0"/>
           </Functor>
        </Function>
<!--...e-->
<!--...sFunction instanceOfInteger:16:-->
        <Function>
           <FunctionName Name="_instanceOfInteger@4"/>
           <Functor>
              <InterfaceName Name="lb_I_Integer" Version="1.0"/>
           </Functor>
        </Function>
<!--...e-->
<!--...sFunction instanceOfString:16:-->
        <Function>
           <FunctionName Name="_instanceOfString@4"/>
           <Functor>
              <InterfaceName Name="lb_I_String" Version="1.0"/>
           </Functor>
        </Function>
<!--...e-->
<!--...sFunction:16:-->
        <Function>
           <FunctionName Name="Function2"/>
           <SimpleFn     Return="lbString"/>
        </Function>
<!--...e-->
      </Functions>
<!--...e-->
    </Module>
    <Module>
<!--...sModuleName:8:-->
      <ModuleName Name="library2">
      </ModuleName>
<!--...e-->
<!--...sFunctions:8:-->
      <Functions>
<!--...sFunction:16:-->
        <Function>
           <FunctionName Name="Function3"/>
           <SimpleFn     Return="lbString"/>
        </Function>
<!--...e-->
      </Functions>
<!--...e-->
    </Module>
  </Modules>  
<!--...e-->
</dtdHostCfgDoc>
